{
  "schemaVersion": 1,
  "id": "org.zwtools.art-notes",
  "name": "示例便签",
  "version": "1.1.1",
  "type": "exe",
  "entry": "ArtNotes.exe",
  "prefix": "ArtNotes",
  "host": {
    "product": "ZW3D",
    "versions": [
      2027
    ],
    "architecture": "x64"
  },
  "commands": [
    {
      "id": "ArtNotesOpen",
      "label": "示例便签",
      "arguments": "",
      "environments": [
        "top",
        "part",
        "assembly",
        "drawing"
      ],
      "icon": "resources/tool.png",
      "tooltip": "可保存的便签，演示设置保留和旧设置迁移"
    }
  ],
  "dataPolicy": "preserve",
  "hotUnload": false,
  "description": "可保存的便签，演示设置保留和旧设置迁移"
}
